source,author,title,description,content,publishedAt,url
NPR,Alejandra Borunda,Major budget cuts proposed for the National Oceanic and Atmospheric Administration,"The agency forecasts weather, manages fisheries, and researches the world's oceans, atmosphere, and climate. The proposed budget cuts would slash the climate work entirely.","The Trump administration is proposing deep cuts at the National Oceanic and Atmospheric Administration, according to a draft budget proposal viewed by NPR.
The agency's budget for 2026 would be slas… [+6357 chars]",2025-04-11T20:52:25Z,https://www.npr.org/2025/04/11/nx-s1-5361366/major-budget-cuts-proposed-for-the-national-oceanic-and-atmospheric-administration
Wired,Laura Mallonee,One Man’s Quest to Reforest the Rio Grande Valley,The Tamaulipan thorn forest once covered 1 million acres on both sides of the US-Mexico border. Restoring even a fraction of it could help the region cope with the ravages of a warming world.,"Despite this, Dale says any restoration, no matter how small, is worth the investment. The nursery is currently growing 4,000 seedlings for four more community plots, each an acre or two in size. Sma… [+3216 chars]",2025-04-12T06:00:00Z,https://www.wired.com/story/the-rio-grande-valley-was-once-covered-in-forest-one-man-is-trying-to-bring-it-back/
Gizmodo.com,Margherita Bassi,Scientists Link Mysterious Icelandic Rocks to ‘Little’ Ice Age—and Rome’s Downfall,The unexpected discovery of Greenland rocks in Iceland hints that a centuries-long cold snap may have helped finish off the Western Roman Empire.,"Many historians agree that the fall of the Western Roman Empire, usually dated to the fall of ancient Rome in 476 CE, marked the end of classical antiquity. What they don’t always agree on, however, … [+4543 chars]",2025-04-15T14:25:08Z,https://gizmodo.com/scientists-link-mysterious-icelandic-rocks-to-little-ice-age-and-romes-downfall-2000589292
Time,Justin Worland,Trade Tensions Could Open Opportunities for Climate Action,It’s possible to envision a world where climate considerations become a key focal point in trade discussions.,"In an instant, President Trump landed the most significant blow yet to the post-war trade regime last week as he announced aggressive tariffs on friends and foes alike. Even after his significant bac… [+5379 chars]",2025-04-11T15:33:17Z,https://time.com/7276849/tariffs-trade-tensions-climate-action/
Time,Simmone Shah,"Climate Change Is Putting Everyone’s Livelihood at Stake, Says Sabrina Elba","Sabrina Elba, a Goodwill ambassador for the U.N. speaks to TIME about the importance of supporting farmers in the Global South.","For Sabrina Elba, the fight against climate change must begin in the Global South. The actress, model, and co-founder of the beauty brand SABLE Labs has seen first-hand how climate change is impactin… [+8533 chars]",2025-04-15T12:00:00Z,https://time.com/7277808/sabrina-elba-climate-change-global-south/
Gizmodo.com,Adam Kovac,Dinosaurs Weren’t Fading Before the Asteroid—We Just Suck at Finding Their Fossils,New analysis shows several families of dinosaurs were likely thriving in North America in the latter days of the dinosaur era.,"Diversity is central to one of the biggest questions paleontologists have about dinosaurs. Namely, were these ancient creatures already on the decline when that fateful asteroid came crashing out of … [+4173 chars]",2025-04-12T14:00:53Z,https://gizmodo.com/dinosaurs-werent-fading-before-the-asteroid-we-just-suck-at-finding-their-fossils-2000586879
Scientific American,The Editors,There Is No Such Thing as a Climate Haven,Climate change is everywhere. Moving to a new place because it seems less affected is a fool’s errand,"In September 2024 Hurricane Helene flooded the mountain town of Asheville, N.C., which had once been called a climate haven, a place less prone to the toll of climate change. In March 2025 fires cour… [+6185 chars]",2025-04-15T13:00:00Z,https://www.scientificamerican.com/article/there-is-no-such-thing-as-a-climate-haven/
Slashdot.org,msmash,"Pentagon Axes $5.1 Billion in IT and Consulting Contracts With Accenture, Deloitte","Defense Secretary Pete Hegseth has ordered the termination of multiple IT and consulting contracts with firms including Accenture, Deloitte, and Booz Allen Hamilton, describing them as ""wasteful spending."" 

A Department of Defense memo indicates the cuts tar…","Defense Secretary Pete Hegseth has ordered the termination of multiple IT and consulting contracts with firms including Accenture, Deloitte, and Booz Allen Hamilton, describing them as ""wasteful spen… [+870 chars]",2025-04-11T12:00:00Z,https://news.slashdot.org/story/25/04/11/0712244/pentagon-axes-51-billion-in-it-and-consulting-contracts-with-accenture-deloitte
Politicopro.com,"Chelsea Harvey, E&E News",Three NASA Climate Satellites Are Dying. There’s No Plan to Replace Them,"Scientists are increasingly concerned about the future of Earth science under President Donald Trump, as three key NASA satellites are nearing the end of their missions with no plans for replacement",CLIMATEWIRE | The looming demise of three NASA satellites has scientists bracing for the loss of climate and atmospheric data — especially since there are no plans to replace some of the specialized … [+7419 chars],2025-04-11T14:30:00Z,https://subscriber.politicopro.com/article/eenews/2025/04/02/three-nasa-satellites-are-dying-their-end-could-disrupt-climate-data-00261755
Yahoo Entertainment,Geri Mileva,Iconic American beverage brand on brink of collapse amid series of setbacks: 'Cornucopia of challenges',There are various factors hitting the industry hard.,"Shifting environmental conditions and plant diseases are posing a threat to the orange industry. Meanwhile, evolving consumer habits are reducing demand for orange juice, putting the iconic orange ju… [+3122 chars]",2025-04-11T10:15:58Z,https://www.yahoo.com/news/iconic-american-beverage-brand-brink-101558326.html
BBC News,,"Constance Marten's baby exposed to 'substantial' cold, jury hears","Marten and the baby's father, Mark Gordon, are in the middle of a retrial at the Old Bailey in London.","Daniel SandfordBBC home affairs correspondent
Constance Marten's newborn baby would have been exposed to ""substantial climatic cold stress"" in the first few days she spent camping on the South Downs… [+2626 chars]",2025-04-15T14:16:51Z,https://www.bbc.com/news/articles/c89g0nep49lo
NPR,Sarah Ventre,Jewish students at Georgetown protest detention of professor Badar Khan Suri,"More than 130 Jewish students, staff and alumni from Georgetown University signed a public letter opposing the detention of Badar Khan Suri, saying that President Trump's policies make Jews less safe.","More than 130 Jewish students, staff and alumni from Georgetown University have signed a public letter opposing the arrest and detention of researcher Badar Khan Suri, saying that President Trump's p… [+3724 chars]",2025-04-11T15:15:13Z,https://www.npr.org/2025/04/11/g-s1-59580/jewish-students-at-georgetown-protest-detention-of-professor-badar-khan-suri
New Scientist,James Woodford,Antarctic teams drill oldest ice cores yet in search of climate clues,"Ice cores that record 1.2 million years of Earth’s atmosphere are on their way to Europe to be analysed, and an Australian drilling team is hoping to go even further back in time","The camp at Dome C on the East Antarctic plateau where the Beyond EPICA team are drilling ice cores
Rob Mulvaney
More than a century ago, explorers from several countries raced to reach the globes … [+355 chars]",2025-04-14T18:00:48Z,https://www.newscientist.com/article/2474805-antarctic-teams-drill-oldest-ice-cores-yet-in-search-of-climate-clues/
Time,JENNIFER McDERMOTT and SIBI ARASU / AP,How a Meeting on Shipping Emissions Could Result in World’s First Global Carbon Tax,Many of the world's largest shipping nations will decide Friday whether to impose a tax on carbon emissions from ships.,"Many of the world's largest shipping nations will decide Friday whether to impose a tax on carbon emissions from ships.
If the 174 International Maritime Organization members present all but the Uni… [+2433 chars]",2025-04-11T09:56:25Z,https://time.com/7276725/meeting-on-shipping-emissions-could-prompt-world-first-global-carbon-tax/
NPR,Michael Copley,Climate activists were hacked. There was a link between the victims and an alleged attacker,Prosecutors say the operation was aimed at gathering information to foil lawsuits against the fossil fuel industry over damage communities have faced from climate change.,"For years, the U.S. Justice Department has worked to unravel a global hacking campaign
 that targeted prominent American climate activists. Now, public tax filings reviewed by NPR reveal an unexpect… [+15870 chars]",2025-04-15T09:00:00Z,https://www.npr.org/2025/04/15/nx-s1-5352761/hacking-climate-change-activists-exxonmobil-dcigroup
Newhampshirebulletin.com,Rob Riley,"If not wood, what? If not here, where?",The increasing political divide is weaving itself into how to best sustain public forests and maximize their contribution to society. Recent calls to...,"""Wood is naturally a part of a more circular ecological system; fossil fuel is not."" (Photo by Dana Wormald/New Hampshire Bulletin)
The increasing political divide is weaving itself into how to best… [+4974 chars]",2025-04-14T08:55:12Z,https://newhampshirebulletin.com/2025/04/14/if-not-wood-what-if-not-here-where/
Phys.Org,"European Commission, Joint Research Centre (JRC)",War worsens climate and environmental challenges in Ukraine,"While Ukraine has made significant progress in climate action since the 2010s, and undertaken efforts to align its environmental strategy with EU standards, Russia's invasion in 2022 has contributed to environmental devastation due to the release of potential…","While Ukraine has made significant progress in climate action since the 2010s, and undertaken efforts to align its environmental strategy with EU standards, Russia's invasion in 2022 has contributed … [+7697 chars]",2025-04-11T13:02:05Z,https://phys.org/news/2025-04-war-worsens-climate-environmental-ukraine.html
Science Daily,,Colombia's peatlands could be a crucial tool to fight climate change: But first we have to find them,Researchers conducted three years of extensive fieldwork to develop the first data-driven map of both newly documented and predicted peatlands across Colombia's eastern lowlands.,"UC Santa Cruz Assistant Professor of Environmental Studies Scott Winton has been wading through thick, smelly muck in the tropics for almost a decade. He wouldn't have it any other way. As a wetland … [+7485 chars]",2025-04-15T20:03:52Z,https://www.sciencedaily.com/releases/2025/04/250415160352.htm
Phys.Org,"Ethan I. Thorpe, Michael Vandenbergh, Zdravka Tzankova","Companies will still face pressure to manage for climate change, even as government rolls back US climate policy","As the federal government moves to eliminate U.S. climate rules, companies still face pressure to be better stewards of the planet from their customers, investors, employees, local communities, lenders, insurers, global trading partners and many states.","As the federal government moves to eliminate U.S. climate rules, companies still face pressure to be better stewards of the planet from their customers, investors, employees, local communities, lende… [+8185 chars]",2025-04-14T16:05:05Z,https://phys.org/news/2025-04-companies-pressure-climate-policy.html
Phys.Org,Science X,US climate cuts hurting global science: Europe's weather agency,Europe's meteorological agency says cuts by US President Donald Trump's administration to a key American science agency had hindered the sharing of crucial observations used around the globe to monitor the climate and forecast weather.,Europe's meteorological agency says cuts by US President Donald Trump's administration to a key American science agency had hindered the sharing of crucial observations used around the globe to monit… [+2738 chars],2025-04-15T09:39:04Z,https://phys.org/news/2025-04-climate-global-science-europe-weather.html
Phys.Org,Cecil MORELLA,"Early holiday, more fans: Philippines schools adapt to climate change",Kindergarten teacher Lolita Akim fires up five standing fans with three more at the ready as she fights to hold the attention of her pint-sized pupils in Manila's soaring heat.,"Kindergarten teacher Lolita Akim fires up five standing fans with three more at the ready as she fights to hold the attention of her pint-sized pupils in Manila's soaring heat.
Last year, heat waves… [+5586 chars]",2025-04-11T08:30:31Z,https://phys.org/news/2025-04-early-holiday-fans-philippines-schools.html
Business Insider,Sarah Perkel,The CEO of Microsoft AI has some 'sort of obvious' advice for young people looking to succeed,"Mustafa Suleyman said workers will develop ""symbiotic"" relationships with AI assistants, and young people should begin preparing now.","Mustafa Suleyman said workers will develop ""symbiotic"" relationships with AI agents.PATRICK T. FALLON
<ul><li>Mustafa Suleyman, CEO of Microsoft AI, said he expects the future of work to include ""sy… [+3639 chars]",2025-04-12T11:06:01Z,https://www.businessinsider.com/microsoft-ai-ceo-mustafa-suleyman-advice-young-people-2025-4
Al Jazeera English,Al Jazeera,UN agrees deal on shipping emissions despite US threats,The US pulled out of the climate talks at the International Maritime Organization in London this week.,"Countries at the United Nations shipping agency have struck a deal on a global fuel emissions standard for the maritime sector, which will impose an emissions fee on ships that breach it and reward v… [+2769 chars]",2025-04-11T17:28:23Z,https://www.aljazeera.com/news/2025/4/11/un-agrees-deal-on-shipping-emissions-despite-us-threats
The New Yorker,The New Yorker,Briefly Noted,"“The Maverick’s Museum,” by Blake Gopnik; “The Franklin Stove,” by Joyce E. Chaplin; “The Dream Hotel,” by Laila Lalami; and “Hunchback,” by Saou Ichikawa, translated from the Japanese by Polly Barton.","The Mavericks Museum, by Blake Gopnik (Ecco). Albert C. Barnes was born into poverty in 1872, in Philadelphia, and went on to make a fortune as the inventor of a topical antiseptic and to amass a sta… [+1434 chars]",2025-04-14T10:00:00Z,https://www.newyorker.com/magazine/2025/04/21/the-mavericks-museum-the-franklin-stove-the-dream-hotel-and-hunchback
Theregister.com,Brandon Vigliarolo,"AI to more than double global datacenter electricity use by 2030, say global policy wonks","No worries, just use neural networks to optimize systems powering neural networks
Analysis Global datacenter electricity use is set to more than double by 2030 - slightly surpassing Japan's total consumption - with AI named as the biggest driver.…<!--#include…","Analysis Global datacenter electricity use is set to more than double by 2030 - slightly surpassing Japan's total consumption - with AI named as the biggest driver.
That's the conclusion of the Inte… [+6023 chars]",2025-04-12T12:58:11Z,https://www.theregister.com/2025/04/12/ai_double_datacenter_energy/
Phys.Org,Massachusetts Institute of Technology,"Hundred-year storm tides to hit Bangladesh every decade as climate change intensifies, scientists report","Tropical cyclones are hurricanes that brew over the tropical ocean and can travel over land, inundating coastal regions. The most extreme cyclones can generate devastating storm tides—seawater that is heightened by the tides and swells onto land, causing cata…","Tropical cyclones are hurricanes that brew over the tropical ocean and can travel over land, inundating coastal regions. The most extreme cyclones can generate devastating storm tidesseawater that is… [+7798 chars]",2025-04-11T15:05:53Z,https://phys.org/news/2025-04-year-storm-tides-bangladesh-decade.html
Yahoo Entertainment,Timothy McGill,Scientists discover alarming global impacts of issue occurring in the Arctic: 'Striking similarities',"""There is much scientific disagreement about the remote effects of Arctic sea ice loss.""","An international team of scientists said it's found a link between the melting of Arctic sea ice and weather in far-flung parts of the planet.
What's happening?
Weather teleconnections are one way … [+3509 chars]",2025-04-13T10:45:57Z,https://www.yahoo.com/news/scientists-discover-alarming-global-impacts-104557004.html
BBC News,,Katy Perry set for space with all-women crew on Blue Origin rocket,Six women—including pop star Katy Perry—are set to blast off into space as part of an all-women suborbital mission,"Maddie MolloyBBC Climate &amp; Science reporter
The singer will be aboard Blue Origin's New Shepard rocket
Pop star Katy Perry and five other women are set to blast into space aboard Jeff Bezos' sp… [+4404 chars]",2025-04-14T07:54:39Z,https://www.bbc.com/news/articles/cvg8e5gq8ljo
VentureBeat,Dean Takahashi,Nvidia pledges to build its own factories in the U.S. for the first time to make AI supercomputers,Nvidia said it is working with its manufacturing partners to build factories that will produce AI supercomputers in the U.S.,"Nvidia said it is working with its manufacturing partners to design and build factories that, for the first time, will produce Nvidia AI supercomputers entirely in the U.S.
Together with leading man… [+2911 chars]",2025-04-14T15:05:00Z,https://venturebeat.com/games/nvidia-pledges-to-build-its-own-factories-in-the-u-s-for-the-first-time-to-make-ai-supercomputers/
Vox,Umair Irfan,The freaky part of allergy season that no one warned you about,"Pollen allergy season is getting longer and more intense as the climate changes, creating more misery for allergy sufferers. But it’s not the only type of allergy threat getting worse with warming.  There are other allergens, like mold spores, whose spread co…","An Asian hornet.


Pollen allergy season is getting longer and more intense as the climate changes, creating more misery for allergy sufferers. But it’s not the only type of allergy threat getting w… [+7258 chars]",2025-04-11T17:09:50Z,https://www.vox.com/climate/408287/allergy-season-insects-pollen-climate-change
The New Yorker,Bill McKibben,Donald Trump’s Tariffs and the Price of Calm,Bill McKibben writes about the worldwide turmoil created by President Donald Trump’s rapid imposition of tariffs.,"I happened to be in northern EuropeFinland and Estoniaduring the days of President Donald Trumps operatic tariff gambit, from his opening announcement that the days when other nations raped and loote… [+7666 chars]",2025-04-14T10:00:00Z,https://www.newyorker.com/news/the-lede/donald-trumps-tariffs-and-the-price-of-calm-northern-europe
Scientific American,"Rachel Feltman, Fonda Mwangi, Alex Sugiura","Length of a Day on Uranus Revised, Pour Height Influences Coffee Quality, and Plastics Recycling Falls Short.","A fluid study homes in on the best method to make a cup of coffee, scientists use the Hubble Telescope to reassess the length of a day on Uranus, and we discuss more of the latest in science in this news roundup.","Rachel Feltman: Happy Monday, listeners! For Scientific American’s Science Quickly, I’m Rachel Feltman. Let’s catch up on some of the science news you might have missed last week.
We’ll ease into th… [+7573 chars]",2025-04-14T10:00:00Z,https://www.scientificamerican.com/podcast/episode/length-of-a-day-on-uranus-revised-pour-height-influences-coffee-quality-and/
ABC News,Aaron Katersky,Harvey Weinstein faces #MeToo retrial as imprisoned movie mogul returns to court,The sequel to the biggest victory of the #MeToo era starts Tuesday when disgraced film producer Harvey Weinstein is re-tried in New York for alleged sex crimes.,"The sequel to the biggest victory of the #MeToo era starts Tuesday when disgraced film producer Harvey Weinstein is retried in New York for alleged sex crimes.
It could take five days to seat a jury… [+2007 chars]",2025-04-15T09:15:23Z,https://abcnews.go.com/US/harvey-weinstein-faces-metoo-retrial-imprisoned-movie-mogul/story?id=120807395
Yahoo Entertainment,Geri Mileva,Authorities stumble upon unexpected energy drain during raid on abandoned warehouse: 'The largest cost input',"The facility appeared deserted, but it housed racks of computers that ran nonstop.","A government raid on an empty warehouse in Abkhazia has raised concerns about the unregulated energy consumption of crypto-mining operations. The facility appeared deserted, but it housed racks of co… [+2879 chars]",2025-04-11T10:15:53Z,https://www.yahoo.com/news/authorities-stumble-upon-unexpected-energy-101553888.html
Grist,Grist Creative,Looking to create effective climate change policy? Ask the community.,"In Seattle, community assemblies are gathering frontline community members to set their own policies around extreme weather.","For Peter Hasegawa, it all started with the heat dome. The labor organizer remembers the 2021 extreme heat event that killed more than 400 people in the state of Washington. That disaster woke up res… [+7499 chars]",2025-04-15T14:30:34Z,http://grist.org/sponsored/looking-to-create-effective-climate-change-policy-community-assembly-seattle/
BBC News,,Global breakthrough to tackle shipping emissions,Countries break ten-year deadlock to agree measures to reduce commercial shipping emissions.,"Esme StallardClimate and science reporter
Countries have agreed a global deal to tackle shipping emissions, after nearly ten years of negotiations.
The agreement covers the vast majority of the wor… [+5865 chars]",2025-04-11T13:27:50Z,https://www.bbc.com/news/articles/c20xxv22wl9o
Business Insider,Morgan McFall-Johnsen,"I'm a coffee expert for a specialty importer and café. We just raised our prices, and I expect others will do the same.","Chris Kornman, a coffee specialist at an importer, says the industry is in a crisis and tariffs made it worse. He thinks customers will soon pay more.","The Crown is a coffee shop in Oakland, California, owned by the importer Royal Coffee.Royal Coffee
<ul><li>Chris Kornman is a coffee specialist and educator for an importer that runs a high-end coff… [+4783 chars]",2025-04-15T17:22:45Z,https://www.businessinsider.com/raised-coffee-prices-expect-other-cafes-shops-will-too-2025-4
Popular Mechanics,Elizabeth Rayne,"Archaeologists Found a 1,000-Year-Old Buddha Statue With Stunning Details","His two typical companions are still missing, though.","""Hearst Magazines and Yahoo may earn commission or revenue on some items through these links.""
<ul><li>An ancient Buddha statue from the early Goryeo dynasty was recently discovered at an archaeolog… [+3599 chars]",2025-04-11T12:00:00Z,https://www.popularmechanics.com/science/archaeology/a64428603/buddha-statue-north-korea/
Mental Floss,CaLea Johnson,"Indian’s Thar Desert Is Getting Greener, Thanks to Human Activity","Thanks to increased accessibility to water and energy, the Thar Desert is now the most populated desert on Earth.","Climate change has had a far-reaching impact on the environment, from increased pathogens found in polar bears to higher levels of seafood contamination. Though its effects are overwhelmingly negativ… [+1793 chars]",2025-04-11T19:01:00Z,https://www.mentalfloss.com/india-thar-desert-greener-climate-change
Quartz India,Ben Kesslen,The 5 most environmentally-friendly states in America — and the 5 least environmentally-friendly,"Going green isn’t just good for the planet — it’s smart for your wallet, too. In the U.S. alone, weather and climate disasters caused a staggering $182.7 billion in damage last year, and those costs are only projected to keep climbing. But not every state is …","Going green isnt just good for the planet its smart for your wallet, too. In the U.S. alone, weather and climate disasters caused a staggering $182.7 billion in damage last year, and those costs are … [+1079 chars]",2025-04-14T09:00:00Z,https://qz.com/5-most-least-environmentally-friendly-u-s-states-1851775055
Forbes,"Angelica Mari, Senior Contributor, 
 Angelica Mari, Senior Contributor
 https://www.forbes.com/sites/angelicamarideoliveira/",Brazil Evolves Smart City Technology To Combat Climate Change,Authorities at city and state-levels are broadening adoption of sensor-based technologies and interoperable data analytics approaches to face extreme weather events,"Flooding in the Jardim Pantanal district, which is located in a floodplain area of the Tiete River. ... More These are new neighborhoods affected by the frequent floods. (Photo by Fabio Vieira/FotoRu… [+10982 chars]",2025-04-15T13:27:42Z,https://www.forbes.com/sites/angelicamarideoliveira/2025/04/15/brazil-evolves-smart-city-technology-to-combat-climate-change/
Project Syndicate,Gary Yohe,The EPA’s Rejection of Climate Science Threatens Everyone,"The US Environmental Protection Agency recently announced that it was undertaking a formal review of its “endangerment finding,” which declares that climate change is real and caused by human activity. Unless it is stopped, the review could provide cover for …","The US Environmental Protection Agency recently announced that it was undertaking a formal review of its endangerment finding, which declares that climate change is real and caused by human activity.… [+5997 chars]",2025-04-14T14:36:30Z,https://www.project-syndicate.org/commentary/epa-reconsiders-endangerment-finding-major-attack-on-climate-science-by-gary-yohe-2025-04
