source,author,title,description,content,publishedAt,url
ABC News,ABC News,WATCH: Blue Origin mission with all-female crew launches into space,"Blue Origin’s NS-31 mission launched into space on Monday morning with an all-female crew, including pop star Katy Perry.","<ul><li>Suspect arrested after alleged arson at Pennsylvania governors house
</li><li>Trump signals new electronics tariffs in White House shift
</li><li>US spring breakers detained in Denmark
</l… [+4306 chars]",2025-04-14T14:13:47Z,https://abcnews.go.com/US/video/blue-origin-mission-female-crew-launches-space-120787758
ABC News,ABC News,WATCH: Blue Origin's all-female crew exit capsule after spaceflight,"Blue Origin’s all-female crew, which includes pop star Katy Perry, completed their trip into space Monday morning.","<ul><li>Suspect arrested after alleged arson at Pennsylvania governors house
</li><li>Trump signals new electronics tariffs in White House shift
</li><li>US spring breakers detained in Denmark
</l… [+4306 chars]",2025-04-14T15:02:26Z,https://abcnews.go.com/International/video/blue-origin-female-crew-exit-capsule-after-spaceflight-120788372
ABC News,ABC News,"WATCH: Knicks player surprises local teen with $60,000","Calvin Mar, 18,got the chance to meet one of his idols, Karl-Anthony Towns, before the game. The two connected over the shared experience of losing a parent.","<ul><li>Putin meets Trump envoy
</li><li>Latest on the helicopter crash in Hudson River
</li><li>China strikes back with 125% tariff on US goods
</li><li>Judge rules against Columbia University st… [+4517 chars]",2025-04-12T14:24:59Z,https://abcnews.go.com/GMA/Living/video/knicks-player-surprises-local-teen-60000-120743805
ABC News,ABC News,WATCH: Quick-thinking wife saves husband from alligator attack in retirement community,"A South Carolina wife-turned-warrior fought off an alligator that had attacked her husband in their backyard, authorities said.","<ul><li>Small plane crashes in Boca Raton, Florida; all 3 on board killed
</li><li>How the trade war with China could impact prices in US
</li><li>China to increase tariffs on US goods to 125%
</l… [+4385 chars]",2025-04-11T12:46:07Z,https://abcnews.go.com/US/video/quick-thinking-wife-saves-husband-alligator-attack-retirement-120709658
Forbes,"David Vetter, Senior Contributor, 
 David Vetter, Senior Contributor
 https://www.forbes.com/sites/davidrvetter/","Europe ‘Frankly Insane’ To Keep Importing Fossil Fuels, Scientist Says",Experts have blasted both the EU and U.S. governments in response to a new report confirming that Europe is the world's fastest warming continent.,"Soldiers search wrecked cars in Massassana, eastern Spain, in the aftermath of deadly floods in ... More November 2024.
AFP via Getty Images
Leading scientists have reacted with exasperation to a m… [+4000 chars]",2025-04-15T09:41:17Z,https://www.forbes.com/sites/davidrvetter/2025/04/15/europe-frankly-insane-to-keep-importing-fossil-fuels-scientist-says/
NPR,Nate Perez,Federal funding freeze halts key infrastructure projects in tribal communities,"Riverbank stabilization, lead and asbestos contamination are just some of the projects tribes planned to address before the Trump administration froze funds.","The Tebughna Foundation
 threw a big celebration in February after the Environmental Protection Agency awarded the nonprofit $20 million to renovate or replace 20 homes contaminated with asbestos an… [+8628 chars]",2025-04-15T01:55:32Z,https://www.npr.org/2025/04/14/nx-s1-5342539/federal-funding-freeze-halts-native-american-projects
Yahoo Entertainment,Namrata Sen,"JPMorgan Chase, Morgan Stanley And Wells Fargo Face Earnings Uncertainty Amid Trump Tariff Fallout And Market Turmoil",U.S. investment banks are set to announce their earnings in an economic climate marred by turbulence and the repercussions of President Donald Trump‘s...,"U.S. investment banks are set to announce their earnings in an economic climate marred by turbulence and the repercussions of President Donald Trumps tariffs, which have led to a substantial decline … [+3291 chars]",2025-04-11T10:08:15Z,https://finance.yahoo.com/news/jpmorgan-chase-morgan-stanley-wells-100815462.html
Skift,Darin Graham,New Global Rules to Force Cruise Ships to Pay for Carbon Emissions,"The shipping industry just became the first to adopt a global system that charges companies for emissions — a landmark moment for climate accountability. If cruise ships can pay for their pollution, which industry is next? -Darin Graham","Cruise ship companies will have to pay for the carbon dioxide produced by their vessels under new global rules agreed to on Friday.
The deal, led by the International Maritime Organization (IMO), co… [+5301 chars]",2025-04-14T18:40:43Z,http://skift.com/2025/04/14/new-global-rules-to-force-cruise-ships-to-pay-for-carbon-emissions/
Yanko Design,Srishti Mitra,ClayPonic V1 Is A 3D-Printed Clay Hydroponics System Revolutionizing Urban Farming,"ClayPonic V1 Is A 3D-Printed Clay Hydroponics System Revolutionizing Urban FarmingEcoTech Lab, under the leadership of architect Logman Arja, has unveiled ClayPonic V1—a forward-thinking, sustainable urban farming system that challenges conventional approache…","EcoTech Lab, under the leadership of architect Logman Arja, has unveiled ClayPonic V1a forward-thinking, sustainable urban farming system that challenges conventional approaches to food production. D… [+3067 chars]",2025-04-15T21:30:58Z,https://www.yankodesign.com/2025/04/15/clayponic-v1-is-a-3d-printed-clay-hydroponics-system-revolutionizing-urban-farming/
Geeksaresexy.net,Geeks are Sexy,"Lab-grown meat: you may find it icky, but it could drive forward medical research","James Hague, The Open University Lab-grown meat causes heated debates. Proponents see benefits for the climate and animal welfare. Opponents worry about a Frankenstein food they regard as risky and unnatural. Whatever your opinion, the technology underpinning…","James Hague, The Open University
Lab-grown meat causes heated debates. Proponents see benefits for the climate and animal welfare. Opponents worry about a Frankenstein food they regard as risky and … [+5931 chars]",2025-04-14T16:00:23Z,https://www.geeksaresexy.net/2025/04/14/lab-grown-meat-you-may-find-it-icky-but-it-could-drive-forward-medical-research/
The New Republic,Ellie Quinlan Houghtaling,Trump Plans Potentially Deadly Cuts for Weather Research,"Next on the White House’s chopping block: the National Oceanic and Atmospheric Administration.
The Trump administration is planning to close “all weather and climate labs and eviscerate its budget along with several other NOAA offices,” CNN reported Friday. …","The firms will provide services to causes President Trump and the Law Firms both support and agree to work on, including in the following areas: Assisting Veterans and other Public Servants, includin… [+801 chars]",2025-04-11T18:14:39Z,https://newrepublic.com/post/193927/donald-trump-plans-deadly-cuts-weather-research-noaa
/FILM,staff@slashfilm.com (Joe Roberts),A Mind-Bending Sci-Fi Movie Is Dominating Max's Streaming Charts,"A small 2024 sci-fi film is riding high on Max's streaming charts. Given how much money it made at the box office, we'd never expect it to chart this high.","""2073"" takes place in that very year and focuses on Ghost (Samantha Morton), a woman living in a deserted shopping center in ""New San Francisco"" 37 years after ""The Event."" Ghost is, as her name sugg… [+1574 chars]",2025-04-13T11:45:00Z,https://www.slashfilm.com/1832402/sci-fi-movie-2073-max-streaming-charts/
Designboom,kat barandy I designboom,foster + partners channels saudi arabia streetscapes for expo 2025 osaka pavilion,"the massing of foster + partners' pavilion recalls the organic shapes and meandering streets of saudi arabia's traditional villages. 
The post foster + partners channels saudi arabia streetscapes for expo 2025 osaka pavilion appeared first on designboom | arc…","Saudi Arabia’s vernacular channeled in Osaka
At Expo 2025 Osaka, amid the bold gestures and cultural showcases from around the globe, the Saudi Arabia Pavilion by Foster + Partners offers something … [+3698 chars]",2025-04-15T16:01:43Z,https://www.designboom.com/architecture/foster-partners-saudi-arabia-expo-2025-osaka-pavilion-04-15-2025/
